{
	"$schema": "https://json-schema.org/draft/2020-12/schema",
	"$id": "https://ackb.local/schema/article.schema.json",
	"title": "ACKB article",
	"description": "One external resource (a link) with its tags. The file name is the article id. Tags are the edges of the knowledge graph: they connect the article to ICs, subcircuits, modules and so on, and through them to related articles.",
	"type": "object",
	"additionalProperties": false,
	"required": ["schemaVersion", "title", "url", "type", "summary", "kinds", "added"],
	"properties": {
		"$schema": { "type": "string" },
		"schemaVersion": { "const": 3 },
		"title": { "type": "string", "minLength": 3, "maxLength": 160, "description": "The resource's own title" },
		"url": { "type": "string", "format": "uri", "pattern": "^https?://" },
		"type": { "enum": ["website", "paper", "datasheet", "patent", "repo", "video", "forum", "manual", "schematic"] },
		"authors": { "$ref": "#/$defs/idList", "description": "Ids from data/taxonomy/authors.json" },
		"origin": {
			"enum": ["manufacturer", "academic"],
			"description": "Who published it, when the type doesn't say (e.g. a university lecture video). Sets the confidence."
		},
		"year": { "type": "integer", "minimum": 1900, "maximum": 2100 },
		"lang": { "type": "string", "pattern": "^[a-z]{2}$", "description": "ISO 639-1, default en" },
		"license": { "type": "string" },
		"summary": { "type": "string", "minLength": 20, "maxLength": 600, "description": "What this resource covers, in your own words" },
		"summaryFromGroup": {
			"const": true,
			"description": "Summary was inherited from a former multi-link topic and should be rewritten for this article"
		},
		"manufacturers": { "$ref": "#/$defs/idList", "description": "Ids from data/taxonomy/manufacturers.json" },
		"products": { "$ref": "#/$defs/idList", "description": "Ids from data/taxonomy/products.json" },
		"modules": { "$ref": "#/$defs/idList", "description": "Ids from data/taxonomy/modules.json; empty for general topics (history, theory)" },
		"subcircuits": { "$ref": "#/$defs/idList", "description": "Ids from data/taxonomy/subcircuits.json" },
		"functions": { "$ref": "#/$defs/idList", "description": "Ids from data/taxonomy/functions.json" },
		"ics": { "$ref": "#/$defs/idList", "description": "Ids from data/taxonomy/ics.json" },
		"kinds": {
			"type": "array",
			"minItems": 1,
			"uniqueItems": true,
			"items": { "enum": ["build-guide", "explanation", "analysis", "schematic", "reference"] },
			"description": "What the resource is: step-by-step build, how it works, maths/measurements, bare schematics, or reference material (manuals, datasheets, calculators)."
		},
		"added": { "type": "string", "format": "date" },
		"reviewed": { "type": "string", "format": "date" }
	},
	"$defs": {
		"id": { "type": "string", "pattern": "^[a-z0-9]+(-[a-z0-9]+)*$", "description": "kebab-case" },
		"idList": { "type": "array", "uniqueItems": true, "items": { "$ref": "#/$defs/id" } }
	}
}
