{
	"$schema": "../../schema/article.schema.json",
	"schemaVersion": 3,
	"title": "Designing a classic transistor-VCA from scratch",
	"url": "https://www.youtube.com/watch?v=yMrCCx6uqcE",
	"type": "video",
	"authors": [
		"moritz-klein"
	],
	"summary": "Video design of a VCA built from discrete transistors (differential pair), explained step by step on the breadboard.",
	"modules": [
		"vca"
	],
	"subcircuits": [
		"differential-pair",
		"current-mirror"
	],
	"functions": [
		"current-controlled-amplification"
	],
	"kinds": ["explanation"],
	"added": "2026-09-26"
}
