{
	"$schema": "../../schema/article.schema.json",
	"schemaVersion": 3,
	"title": "VCA-1 and VCA-2",
	"url": "https://www.schmitzbits.de/vca.html",
	"type": "schematic",
	"authors": [
		"rene-schmitz"
	],
	"summary": "Two VCAs built around discrete differential transistor pairs, dimensioned for 5 Vpp signals.",
	"modules": [
		"vca"
	],
	"subcircuits": [
		"differential-pair",
		"current-mirror",
		"opamp-stage"
	],
	"functions": [
		"current-controlled-amplification"
	],
	"kinds": ["schematic"],
	"added": "2026-09-26"
}
