{
	"$schema": "../../schema/article.schema.json",
	"schemaVersion": 3,
	"title": "Introducing the mki x es.edu DIY VCA kit",
	"url": "https://www.youtube.com/watch?v=NuS8slR2Ue0",
	"type": "video",
	"authors": [
		"moritz-klein"
	],
	"summary": "Introduction videos for the educational DIY modules designed by Moritz Klein with Erica Synths: VCO, VCA, envelope generator, sequencer, VCF, S&H/noise and mixer. Each kit comes with a manual that teaches the design on a breadboard.",
	"summaryFromGroup": true,
	"modules": [
		"oscillator",
		"vca",
		"envelope",
		"filter",
		"utility"
	],
	"kinds": ["build-guide"],
	"added": "2026-09-26"
}
