{
	"$schema": "../../schema/article.schema.json",
	"schemaVersion": 3,
	"title": "ECE4450 L6: Roland 130 VCA Analysis",
	"url": "https://www.youtube.com/watch?v=_rDZ9R-HHEo",
	"type": "video",
	"authors": [
		"aaron-lanterman"
	],
	"origin": "academic",
	"summary": "Step-by-step analysis of the discrete VCA in the Roland System-100M 130 module, building on the OTA lecture.",
	"manufacturers": [
		"roland"
	],
	"products": [
		"system-100m"
	],
	"modules": [
		"vca"
	],
	"subcircuits": [
		"differential-pair",
		"current-mirror"
	],
	"functions": [
		"current-controlled-amplification"
	],
	"kinds": ["explanation", "analysis"],
	"added": "2026-09-26"
}
