{
	"$schema": "../../schema/article.schema.json",
	"schemaVersion": 3,
	"title": "How to loop any envelope",
	"url": "https://www.youtube.com/watch?v=L9vTz0vm6pc",
	"type": "video",
	"authors": [
		"moritz-klein"
	],
	"summary": "A tiny utility circuit, suggested as a first project, that retriggers an envelope from its own output so it loops like an LFO.",
	"modules": [
		"envelope"
	],
	"subcircuits": [
		"comparator",
		"voltage-follower"
	],
	"functions": [
		"periodic-modulation"
	],
	"kinds": ["build-guide", "explanation"],
	"added": "2026-09-26"
}
