{
	"$schema": "../../schema/article.schema.json",
	"schemaVersion": 3,
	"title": "Dintree DSupply Power Supply: schematic, parts list and design notes",
	"url": "https://github.com/hires/Dintree/tree/master/DSupply-Power_Supply",
	"type": "repo",
	"authors": [
		"andrew-kilpatrick"
	],
	"license": "non-commercial, educational use",
	"summary": "Minimal ±12 V Eurorack supply from a +15 V input using hand-solderable DC-DC converters, for one or two rows of modules.",
	"modules": [
		"power-supply"
	],
	"subcircuits": [
		"decoupling-network"
	],
	"kinds": ["schematic", "explanation"],
	"added": "2026-09-28"
}
