{
	"$schema": "../../schema/article.schema.json",
	"schemaVersion": 3,
	"title": "Complete beginner's guide to using a breadboard",
	"url": "https://www.youtube.com/watch?v=XpMZoR3fgd0",
	"type": "video",
	"authors": [
		"moritz-klein"
	],
	"summary": "Beginner's guide to using a breadboard for synth circuits, and a DIY prototyping station for developing synth modules.",
	"summaryFromGroup": true,
	"modules": [
		"utility"
	],
	"kinds": ["build-guide"],
	"added": "2026-09-26"
}
