{
	"$schema": "../../schema/article.schema.json",
	"schemaVersion": 3,
	"title": "Tube filter",
	"url": "https://www.schmitzbits.de/vtvcf.html",
	"type": "schematic",
	"authors": [
		"rene-schmitz"
	],
	"summary": "A high-voltage Sallen-Key filter, the MS-20 topology, built with a triode and a pentode and controlled by LDRs, designed for the author's all-tube synthesizer.",
	"modules": [
		"filter"
	],
	"subcircuits": [
		"vacuum-tube-stage",
		"sallen-key"
	],
	"functions": [
		"resonance-control"
	],
	"kinds": ["explanation", "schematic"],
	"added": "2026-09-26"
}
