{
	"$schema": "../../schema/article.schema.json",
	"schemaVersion": 3,
	"title": "ECE4450 L24: State Variable Filters and the Oberheim SEM VCF",
	"url": "https://www.youtube.com/watch?v=jAokGV71MEw",
	"type": "video",
	"authors": [
		"aaron-lanterman"
	],
	"origin": "academic",
	"summary": "Second-order filters from their mathematical structure to practical state-variable designs, with the Oberheim SEM filter as the main example and further SVF circuits.",
	"summaryFromGroup": true,
	"manufacturers": [
		"oberheim"
	],
	"products": [
		"sem"
	],
	"modules": [
		"filter"
	],
	"subcircuits": [
		"state-variable",
		"integrator",
		"ota-stage"
	],
	"functions": [
		"multimode-output",
		"lowpass-response",
		"bandpass-response",
		"highpass-response",
		"resonance-control"
	],
	"kinds": ["analysis"],
	"added": "2026-09-26"
}
